{
  "id": "01jrcasebox00000000000ct03",
  "tenant_id": "tenant-local-v1",
  "actor_user_id": "local-user",
  "matter_id": "01jrcasebox0000000000000m1",
  "track_type": "counterclaim",
  "claimant_party_id": "01jrcasebox0000000000000p1",
  "respondent_party_id": "01jrcasebox0000000000000p2",
  "our_role": "asserting",
  "title": "Counterclaim — set-off for defective prior delivery",
  "claim_summary": "Our client asserts a counterclaim for set-off arising from an earlier defective delivery by the counterparty.",
  "response_summary": "",
  "legal_basis": "Contract Law art. 568 — statutory set-off of mutual due debts.",
  "calculation_summary": "Set-off amount 90000 against the counterparty's claimed balance.",
  "status": "active",
  "sort_order": 2,
  "created_at": "2026-07-15T09:10:00.000Z",
  "updated_at": "2026-07-15T09:10:00.000Z"
}
