{
  "id": "01jrcasebox00000000000ct04",
  "tenant_id": "tenant-local-v1",
  "actor_user_id": "local-user",
  "matter_id": "01jrcasebox0000000000000m2",
  "track_type": "main_claim",
  "claimant_party_id": "01jrcasebox0000000000000p2",
  "respondent_party_id": "01jrcasebox0000000000000p1",
  "our_role": "responding",
  "title": "Principal claim (defense) — denial of construction-defect liability",
  "claim_summary": "",
  "response_summary": "Our client defends the counterparty's principal claim: the alleged defects fall outside the warranty scope and were caused by the counterparty's own use.",
  "legal_basis": "Contract Law art. 621 — buyer's inspection-and-notice obligations.",
  "calculation_summary": "",
  "status": "active",
  "sort_order": 0,
  "created_at": "2026-07-15T10:00:00.000Z",
  "updated_at": "2026-07-15T10:00:00.000Z"
}
